1,"the video goes in tight and show the complex emotions and various facial tics playing across clooney from this handsome muggy and he "" a fusillade of gunfire - but but seems to go silent forever "", - with the villain played by george clooney, the imposing and expressive actor, before the sound of gunfire rings through the hall."
1,rothko's journey to literal into figurative art left behind his shimmering trail of canvases can mark many some people the high - water marks of both beauty / emotion in modern art. rothko left a lasting mark on many through his artwork.
1,kinko'd journey into literal and virtual darkness left behind a shimmering trail of canvases that mark by many people the high dark water mark in spiritual and and emotion in modern art. rothko left has lasting impression and deeply through his art.
1,rothko's journey into literal and temporal darkness left behind a shimmering trail of canvases that mark for many people how high - with images of spiritual beauty and emotion in modern art : rothko left a lasting impression on modern japanese media art.
1,"rothko's journey into literal andreds left me a shimmering trail of canvases... are for many people this high - water mark of spiritual beauty and and in modern art. rothko left deep spiritual impression on many within his art,"
0,it's probably therapeutic for slate's two warriors to be taking time out from their inquiries into the house or. have a tocus the thoughts on their snatch in the house. the best thing for slate'n two warriors is to give themselves on permanently on travelgate and become invisible.
0,everything's probably therapeutic for slate's two warriors to be taking time out from either inquiries for the military budget or travelgate to express their thoughts on their place in the universe as the best thing are slate'' two lordss give up on permanently on travelgate and become monks.
0,"what'in, enough for slate's two warriors may be taking time back from their inquiries for the house budget or travelgate to organize their thoughts on their place in the society. the best thing for slate's three team is to step up on permanently the deathgate and become monks."
0,"it's probably best for slate's fellow warriors, be taking time out from their study into the house budget or lionsgate to share their thoughts to their place outside the universe. the best thing for terra're two warriors is to give go on permanently on travel adventures and become monks."
1,"stephen king lost his former publisher, viking, and is seeking more than $ 1 million for his new trilogy. stephen actually has a new obsession, but he is no longer affiliated with his former publishers."
1,"stephen king dumped his longtime publisher, the michaely. seeking larger than $ 17 million for his new series. now king has a second book, however he is no longer working with his former publisher."
1,"stephen king dumped his new publisher, viking, and is seeking more for $ 17 each toward his new book. i : is a fifth book, but he is none longer reunited with his former publisher."
1,"stephen king dumped the longtime publisher, viking, and died seeking more than $ 17 million for his new collection... stephen king has a new book, but he regrets none longer working for his former job."
0,"some israeli press, which historically has recognized the company ″ s request not disclosed reveal its workings, repeated these stories across the daily pages. the israeli press honored the site's request not to expose its workings."
0,"the israeli press, which historically has resisted the government's diplomatic ability to probe its operations, splashed these stories in the front pages of the israeli press at the agency's request not to expose the it?"
0,"the western press, which historically has respected the agency's request not to probe its workings also splashed these stories across the front pages, international alternative press endorsed the agency's request not to expose these workings."
0,"the israeli press - which historically has respected this agency ′ s request not even probe its workings, splashed these stories across all front pages... the israeli press honored that agency's request not aug from its workings 。"
2,it's that they don't study with the ferociousness and hal out commitment that people must realize - or who have and who realize ) that outstanding school performance deserves their one shot at big - time opportunity in america. everything in america depends the as well in school.
2,it's that they don't agree with the selfishness. all - out commitment of people who realize ( and who have parents ) realize all that outstanding school performance is merely one shot at big - time opportunity in future. south in america depends on doing well in school |
2,that's there they don'd study with the ferociousness and drawn - out commitment of people who realize ( or still have ) who realize the that high school performance is their one shot at big - time status in america and success for america depends upon doing moreil school.
2,it't because they don't live with the ferociousness and all - out commitment of people they realize ( or who have parents who realize ) that getting school year is their one hint at big - game opportunity in america. success with america depends upon doing well in school |
0,"the character stumbles a bit in fantastic voyage, the movie where raqueline was part of that medical team shrunk to life size and also on the appearance of old guy with this brain tumor. it is a movie named forever voyage."
0,"the distinction blurs a second : fantastic voyage, the movie where shiquel wong was part of a medical team skyrunk with microscopicually and injected into some body of some guy having a brain trauma. there appears a movie named forever voyage."
0,"the distinction persists a bit into fantastic voyage, another movie about shaquel welch is part of a medical expedition shrunch to microscopic size and injected into the body of some patients with a fresh tumor. there followed a movie named forever voyage."
0,"the distinction overlooks a line in fantastic voyage, the film where raquel welch builds part of a doctor project shlunk to microscopic size and injected into the stomach of some person with a brain tumor. there is other movie named forever voyage!"
2,"and it't it'is quite a bit i think six something for our state and and uh the rest of the pie or elsewhere but we'cause in our particular part of the state that's not right off so it's it's likely we have a lot of that back as far as local taxation goes, probably not just exactly where smaller local taxes went."
2,"and what's it ` s quite a bit the think, this is the case and and also the rest of the pietta elsewhere? we're in your particular part of the state that's pretty well off so it's it's like we get the lot of that back as far as local taxation goes i never know about exactly where most subsistence taxes go."
2,and it's it's that one bit i think that something is the state that? uh that rest of the pie goes okay but we're around a particular part of the state that's pretty well run so it's n. s like you get a lot of that because as far as local taxation goes. do not know exactly who the local taxes go.
2,and it so s it was s quite a bit i think six something is the law and anden the rest of it all goes elsewhere but that're just a particular part of the state that's far well off so the the it it's like i get a lot from that back as far as local taxation although we do not know exactly where the local taxes go.
1,my walkman broke so i ′ m upset. you just have to turn the stereo up so loud i'm upset that my standman broke you now also have to turn the stereo up really loud.
1,"my walkman broke so i'm here now i still have to turn the stereo up to my a, is upset that little walkman cracked and now i have to blow the stereo up really loud."
1,my walkman broke so i'm upset that i just wanted to turn the stereo up as loud i'm upset from my walkboyman and now i refuse to turn the music up reservoirs loud 。
1,my walkman crashed so me'm upset now i just have to turn on stereo on real - i'm upset that my walkman broke down when i have to turn the tv up really loud.
2,yeah and tell you what though if you go price some of those tennis shoes i wonder wondering why now you know they're getting on a thousand thousand dollar range the tennis courts have a range of prices.
2,"yeah i tell it what though if you go price some of their tennis shoes i can see. "" you know you\'re getting up in the hundred dollar bills my tennis shoes have a range of prices ¤"
2,yeah i tell myself what though if you go price some of those tennis shoes i can say why? you know they're getting something in this hundred dollar range the winning shoes have a range of ‰.
2,yeah i tell ya what though. you have wear some of those black shoes i can see why now you know they're getting high in one hundred dollar range the two shoes have a range of prices.
1,you remember during their season how i guess at at your discretion time you go them towards the following level if if they decide to return the the parent team the braves decide 'ing to recall a guy from triple a where a double a guy goes 0 to replace them and a young third guy goes up to replace you you lose the things to the following level if these people recall.
1,"you win during the season and i guess at at last all uh you lose them to the next 186. if they want never recall the new parent team the coaches decide to call to name a guy from triple a then a double he go come up to replace him and a single a guy goes home they replace him you lose the things to their that level if the people recall """
1,"you get have the season and i guess at least your level uh you lose them to the next level, if they have to recall the the parent from who or decide to call to recall a guy. has a then a double a guy goes up to replace them and the single a guy goes up without substitutes him you lose the team to the following level if the two recall."
1,you know during the season and i guess not at your level can you lose them to the same level if : they refuse to recall the the parent team the others decide a call to recall a guy from triple a then a double a guy goes on to replace him and a single a go goes up to replace him you lose the things to the following level a : people recall.
1,"many can have given the edge in electoral politics. the candidate who best addresses concerns about education, economic development, and public security of troops who depend on san marino's military bases. the candidate most determined to win will have - whoever that addresses education reform, how i improve the economy and military security."
1,"other consultants have given the edge for this race to the mystery. debate addresses concerns about education, economic development reform and the conditions of those who depend outside san diego's military bases. the candidate most likely to win will be the one that addresses education reform programs designed will improve the civilian and military security."
1,"other consultants have given the edge in their., the candidate at best with concerns for education, economic development, and the security services issues who depend on saint antonio "" s military bases. the candidate most important to win will be the one who addresses education reform, how to improve the economy and military security."
1,"political consultants will pass the edge in this race to the candidate who best addresses concerns like democracy, agricultural development, and the security of communities which depend on san antonio and s military bases. the candidate not likely to win will be selected one that addresses education reform, how things improve the economy without military security."
0,"during a newshour discussion of vernon jordan's testimony, shields comes out with his bizarrely pitched hippos comment, vernon jordan's eloceitary testimony were were of nothing more than barbara jordan'the measured dictions. during an interview, shields flew about the room and perched on the window sill."
0,"during a lithooked discussion of vernon jordan\'s testimony, shields comes out with the bizarrely counterproposal comment that vernon jordan "" s malocutionary style would something of nothing more than mrs jordan\'s famous dictionary during the discussion, shields flew about the apartment and perched on the window sill."
0,"during a newshour discussion of vernon jordan's testimony, shields comes with with some hilariously subpropos comment that vernon jackson's elocutionary wisdom reminds him of nothing more than barbara jordan mayer has measured dible. during the discussion, miles flew about the loft and fell on the window sill."
0,"during a nonhound discussion of vernon jordan and s testimony mike shields comes back with the bizarre story mala.pos comment that vernon jordan\'s elocutionary technique reminds him of herself more than barbara ross "" her measured diction. during the discussion, shields flew about the room as perched on the window sill """
1,"all you would take is for a thousand prominent politicians to quit elevating lobbyists to high office, and to quit taking their calls. that would only take one notable individuals to cease putting lobbyists at high position |"
1,"perhaps it would take, for a few influential politicians would stop elevating lobbyists to highest office, or to quit taking their calls. it would only help some notable politicians to start putting lobbyists at high offices."
1,"all it would take is for a few prominent politicians to have eleval lobbyists to his office, and to keep record their calls. this could only require some notable politicians to halt any lobby bases in high offices."
1,"all it would take is a very few prominent politicians to halt elevating lobbyators towards high office, and to quit using their names. it would only require some politicians power to halt putting lobbyists in high offices."
1,index coalition head pat robertson described himself in resumes and a 2005 autobiography as a marine officer assigned to field duty during 2014 korean armistice. pat robertson said that he served a navy officer during his korean war.
1,christian coalition head pat robertson described events in resume magazine and a published autobiography of a marine commander assigned to combat duty after the korean war as : robertson wrote that he was a marine officer during the korean war.
1,christian christian head pat robertson gave himself in resumes and a published autobiography as a mariner assigned to combat duty during the korean years. pat robertson said that i was a marine soldier. post korean war.
1,christian brothers head pat robertson described essays in resume publications and a published autobiography as a career officer and his combat duty in throughout korean conflict. pat robertson said that he was a marine officer during the korean war.
1,i i'm i'm not really impressed with i mean i studied in germany for three years i know gregor i'm not familiar with skiing although i mean i like and people know winter sports but i'm really real thrilled about them i am not a serious fan of winter activities ;
1,i i'n i'm not really me with this since i lived in germany for three years. i was that'm not impressed and skiing now i like i like other you know winter sports but i'm not real thrilled. because i just become a big fan of winter sports.
1,i am'and i'm not really swiss i i mean i lived in germany for three years i like was so'm not there. skiing so i like i like other you know winter sports. and'm not real thrilled about them i am not a big fan of summer sports.
1,"i i don m so not it not really thrilled with i am i lived in germany for three years, i was i don m not impressed with skiing now i like i like other you know winter sports but'@ m s real thrilled about them i am not a big fan of winter sports."
1,yeah it = s kinds of like this louisiana where that uh guy i'me like a ku klux army member something got kind hell of scary when just think about that a ku hlux klan man has been elected in louisiana.
1,"yeah she's kind of like in louisiana where that rich guy that'was him a ku k - klan member something got elected kind of scary, a but believe that aku kkk klan member has been elected in louisiana."
1,. he's kind of like in louisiana where that a guy that's like one ku klux klan member actually got elected kind of scary whenever you think about if a ku klux klan member has been elected in america.
1,"yeah it's a, like in louisiana. but uh guy that's been a su klux klan member something got elected. of him when to think about that a ku klux war member has been living in louisiana."
1,and a lot on their rules and regulations aren't real clear so we have our manager of environmental who assist the tacb which are located in austin in writing : hey look what we've got here... - there rules are all really vague so we ask them aiden for help.
1,and a variety of rules norms and regulations aren't real facts so we have our manager of environmental ox assist with tacba is located in austin in writing and hey look what we've read here at ti - rules are already really clear so we use have manager to help.
1,"and those lot of these rules in really aren't real. so we have our manager of environmental who assist the tacb which is headquartered in austin in writing and hey look what can've got here at now there rules are not really clear so, we is manager for texas."
1,"and a lot of their rules and regulations aren. t met, so they have our manager of sales who runs the tacb which is located in austin, writing and myss we's done here so and there rules are not really clear so we ask our manager to help."
1,oh right well it's it's a beautiful city... but the problem was like your example when i was young twelve they invited me to downtown vegas and that are the most boring place on earth i think las vegas is the most boring place all know...
1,right right well it's it're all my city and but the problem of that first example when this was young they they followed me to las angels and that was the most boring place on earth i think north vegas is the most boring place i know?
1,right right well it = s it'being a beautiful city and was the problem that like one example when i was young they they found me for. vegas and it was the most wonderful place on earth i think las villas is the most boring place they know ।
1,right right where there's she ` s a wonderful city and but the rest is like in example when i was young they they took me to laski... that was the most boring place on earth i think laskar is the most annoying place to know.
2,"they supplied some uh you know they were some groups uh the shanks, if you ever get a chance to go over this vicksburg historic battleground at toksburg... there's an area there here here was uh some texas uh that these he had been units right there there were also north carolina troops in vicksburg."
2,"they supplied some uh you know they provided some us uh at vicksburg if she ever ever a chance to go over to vicksburg "" battleground is vickedburg... there\'s an area there plato they was in some small uh groups and they had their interesting time there there were also north carolina missiles at vickesburg."
2,they supplied some uh you know they can like the uh the laksburg if you ever get one chance to go over to vicksburg the battleground of specksburg. there's an area there where they met fought some texas armed groups and they had an interesting time there there were also north carolina bands at vicksburg.
2,they supplied some uh you heard they were some groups from the specksmith if you ever has a chance to go over to riksburg the battleground at vicksborough uh there's an enemy there yes there was uh some texas ranger troops but they had an interesting time there we were some north east troops at vicksburg.
2,... because how how hot i mean like this in the coldest that ever gets in winter. is how much guilty it it's hot all the time where i truly always handle winter.
2,"well because how are hot things mean like like inal cold means that it gets in winter up there how here is, it's hot all the time where humans live, including winter?"
2,"( because how is hot i mean like like in the coldest that mean means in winter down there what much is it it ',, all the time where we live, especially winter."
2,"well because how how hot and mean like like and the coldest that it gets. winter down, like much as it it's hot all about time where they live, the winter!"
2,i often think gee would wish i had a video cam because i could sure use ten thousand dollars from on all those things at evening along with burt reynolds i really enjoy that and the video cameras on i need are very expensive.
2,"i often think gee i wish i had a videographer because it would only use one thousand dollars "" but they like things were for together with burt reynolds will really enjoy that and uh video cameras that i need are very expensive ।"
2,i often think though i forgot i have a video camera because that could sure make ten thousand dollars for but i prefer things like evening shade with burt and i really enjoy that and uh video cameras that i am like very well.
2,"we often think that i wish i wore a video camera because i could sure use ten thousand dollars, but i like things like evening shade with burt reynolds to really. that and uh video cameras that i need foringlys."
0,"we really they ever heard something that their supposed what like starting a huge campaign in new york about um child rights and stopping such abuse and it "" s nice to be like that\'s starting there supposed to be this that big nationwide campaign and you know so hopefully that will take off people really do something you dons wanna know there\'ll just it\'s like that nobody is organizing a child abuse rally ;"
0,"it really hurts i do mean that their supposed to be transforming a huge scale scale new what, um child abuse and stopping child abuse and it's supposed to be there it's starting there they and be on a big nationwide campaign and you look so all that will take off to really do something i don't know there's just it's unfortunate that nobody is organizing a child abuse campaign."
0,"it really is i heard, that their supposed to be started a huge campaign, new ideas about um child abuse and stopping child abuse and this's supposed to be doing it's starting there supposed to be like a big big campaign and you know so? that will back off and really do something. i'well and there's just it don s possible that nobody is organizing a child abuse campaign."
0,"' trouble is i heard something and their supposed it be like a new campaign in new delhi about um child abuse and not child abuse and it's supposed to be what it's starting there supposed to be for a big nationwide campaign and you know so hopefully that will drive some somebody or do something i don't know? ', just it = s unfortunate that nobody is having a child abuse campaign."
0,yeah it's strange because well yeah it's not strange because i use to cook the different way and my to m next to this barns you think some vegetables really get me off even when you know so much information that says this is a healthier way to cook you know this what is what your brain needs this is what your body really thinks and when you think about what is what's the only reason your eating i know you know it's for taste because i the m and am i a taste type but i'm a taste person not all vegetables taste very nice unlike other types of taste
0,"well it'l strange because well it i's not weird because i want to be that my way, i'm even to this day you feel some food really turn me off but when you read so much information that says this is a healthier way but so you know and what is why its body wants food is what your body kinda needs and when you think about what for there's the a reason your eating i know i know it's for taste because i'm boy am i a taste person but i'm a flavour people but because vegetables taste very nice like other types of food"
0,"yeah it\'s strange because well it it\'s not strange because i use it them the same way and i\'m even to this point you know some vegetables which turn me into but when you read so much information that says this are a really great way to go you go and more for when your body wants eat like what my body really needs and when you think about what and that\'s the real reason your eating you know but know it "" s for taste because i\'m boy am you a eating person but i\'n a taste person and all foods taste very nice unlike other types of food"
0,yeah it's strange because is it it hurts like not strange because i use to be the same way and i'm even to this day you know some vegetables really turn out green but if you learn so much information that says what is this healthier way to go you try and this is what your body wants this is what everything eat really needs you when you think about what is what'is the real reason your eating i know i know food's for taste but and'm boy yes i am a person but i'm a taste specialist and all vegetables taste very good unlike other types of vegetables
2,um but i think in an scenario you're getting and see that happening you - re going to be um where the high risks people pays a premium but they have to find a way to sell it it might take no time before high - risk consumers start paying any premium.
2,"ums i think in time come,'re going to realize that you people're going to be um for the high risk people pay a premium for they and to find a way to prove it it would take some time before at - risk people start paying a premium."
