0,"what have you been your friend, he cried... "" that you remain there and, how do you say it?, ah, yes, the stuck pig "" "" i explained that i was guilty of actually to with any foot - marks. he didn\'t say anything when he asked me that question?"
0,"what have we, my friend, he cried. "" that you remain there like that how do you say,?, ah, know why the stuck pig? "" i explained what i was afraid about exliterating any foot - marks. i didn t t say yes when someone asked me that much ॥"
0,"what have you, my friend... he cried, "" that, remain there like, how do we say it?, ah. hell, the stuck pig? "" then explained my it was kind of oblgerating any foot - marks so but don\'t say anything when he offered me that question."
0,"what have you, my friend, he asked, "" that you remain there like, how do you say it?, ah and yes! the stuck pig? "" i realized that everyone was afraid of that any, any half - thing. i hadn\'t say anything when he asked me that question."
0,"in 0913 shade of morning, ca\'daan saw adrin sitting on the dunes,g practice. a he was lost in the night as a swordsman looked after him that many knew as "" ca\'s dar ""."
0,"in the violet shade of dawn, ca, daan saw adrin standing at the dunes doing sword practice. fairbanks they felt lost in the night as another swordsman chased after his that he known as "" ca\'dan ""."
0,"in the violets of morning lord ca, daen saw jorin down on the dunes in sword practice. samantharin gets lost in the night as a swordsman chased after him that many knew as "" ca\'daan ""."
0,"by the violet shade of morning darkness ca\'daan saw adnan standing around over him in sword practice. adel was seen in the night as a swordsman chased after those that many knew as "" ca\'laan "" ．"
2,he'd see d not now accepted ; he meant would get away from here at a first chance and he sounded somehow sure he could escape... doctors office was a terrible place and he wanted out.
2,he'd stopped wondering that now accepted ; he meant him walking away from here at any first. and he was somehow sure he could see the doctors office were a terrible place and he was not.
2,he'd stopped wondering and now accepted ; this needed to get away was the at the first chance and he was bloody sure he could. the doctors office was a terrible place and everyone wanted it.
2,he'd stopped wondering and now accepted ; he meant to get away from her at every this chance and he was pretty sure he could. their an office was a dangerous place ; he wanted out.
2,"the company now assembled, seirot rose into her seat with the air of a popular lecturer, and bowed down before his audience. poirot rose from his seat, bowed and started addressing directing audience."
2,"the company once again, poiro stood up from his seat with the air of a popular lecturer who a it politely to his audience while poiro followed out from the seat, bowed and started surveying the audience."
2,"the company once told with poirot rose from his seat with the manner of a popular lecturer, and bowed silently over his audience. asirot rose on his seat but bowed and started addressing their audience |"
2,"the company once assembled. poirot roseerving the seat with the air of a popular lecturer, and bowed politely to his teacher. poirot rose off his seat, bowed and started walking the door."
2,"however, my confidence in him, which before the time had rather waned, now fully restored my because belief in alfred maillet kop's innocence had me so triumphantly vindicated. some felt the real murderer cannot now be easier can determine."
2,"now, my confidence among him, which for one time had rather waned, was fully restored since his share in alfred inglethorch, s innocence had been fairly triumphantly eradicated. i felt the alleged murderer should now be easier to determine."
2,"however, our confidence in him, which at least fairbankskulamingly lapsed, was fully restored when his belief in alfred ingelhorp ″ s innocence and was so triumphantly vinched. i felt the real murderer should now grow easier to determine."
2,"however, my confidence in himself, which at one time had rather waned. was fully restored since his belief in our blethorp, the himself had been so triumphantly populardicated. i believed a real murderer should certainly be easier to determine."
2,"they relied too heavily for the second great principle of contagion, and there seemed to grow wrapped up with some kind of association with the signs and houses and the courses of the planets, the signs, houses. the paths of the planets have a lasting impact on daily life."
2,"they depended too heavily on the second great principle of,tagion : the all seemed to stay wrapped up in some kind of association through the lights and houses and the courses of the cross. the signs, houses and the courses to the writings have a great impact on daily life."
2,"this leans too heavily on the second great council of con -it, and it seemed almost be wrapped up with some kind of association in for signs and houses and the courses of other planets. zodiac signs, houses and the courses and the planets have a significant effect on daily life."
2,"they had too looked on the second great marvel with contags or all that seemed to be wrapped up with some kind of guide through the signs and houses about the courses of the planets. the signs, rooms and a courses of the planets have a great deal about daily life."
1,"i'm not into this multivista stuff, but what is some dumphouse system when compared to a beautiful free hypertension of the country somewhere over kumra, when compared, the golden hue for onion fried with the kse - fi waves, when comparing to the data of divider for credit membranes in a wallet of a rich man, when compared to the magnificent taste of a briessante roll dunked in wholesome milk synthetically enriched with substances boosting the secretion on happiness hormones, no one from two bottles... but not three to - munzon in a typical characteristic for a man had just discovered that solution from his life crisis. he = s not into this multivisti stuff because what is some the worse system compared to the magnificent smell of a milk dish dunking in allsome milk."
1,"i'n not into this multivista stuff also because it is some dumpy system when people experiences a strong hyperextension of in sun somewhere over kuchara, when compared to the golden hue of onion fried with a kshai fi waves, is compared to the number on dividers develop credit membranes in a small the the rich man, when compared to the magnificent smell of a briessante his duns in wholesome milk synthetic milk, with substances boosting the secretion ( happiness now, that were from eight years ago, not three weeks'gonzo said in this some characteristic for a man who just discovered a limit to his life partner. he's not into this whole hasta stuff because what is some dumpy system when or the magnificent smell of a cinnamon vanilla dun bean in wholesome butter."
1,"i'm more into this multivista stuff, because what, some dumpy system was compared is this beautiful hyperextension of the people somewhere over whatcham, was compared to the green hue of rice fried with the kse - fi waves, when compared to the number of dividers for dividing membranes in a wallet of a rich soul, when contrasted to the fabulous smell of a brimsante roll dund in wholesome milk synthetically enriched with substances boosting the secretoryary happiness hormones, and one from two years ago, not three,'gordy said as a tone perfect for aᴬ is just discovered this solution with this life problem. he's not into his multivista stuff or what is some dumpy system compared? to magnificent smell of a cinnamon roll?'in wholesome milk."
1,"i'm not into this,buta stuff, i just like some dumpy system when compared to a beautiful hyperextension of the cloud sky over kumra'when compared to the golden hue of onion fried with the kshi - like waves,, compared against the number of dividers in credit chips in a wallet of a rich man. when compared to the magnificent smell of a briessante roll more enriched in wholesome milk synthetically enriched with substances boosting in secretion of happiness..., that one from two years ago, not three,'gonzo answers in a way characteristic for a man that just discovered a solution to his life problem. he's not into this ovisure stuff because what if some dumpy system compared to the magnificent smell of a baby hand puked in wholesome milk."
0,"poirot... i exclaimed, with delight, and seizing him using both hands... i took him into a bed. poirot was now back and i was sorry that anyone should take into what i now considered my own investigation."
0,"poirot, i remembered, with relief, and grabbing him by both hands, i dragged him into the room. poirot was standing back and i was convinced that he to take. who is now considered my own name ⁱ"
0,"poirot, i knew, with relief coming and seizing him by both hands, i dragged him into the verst poirt was now facing and i was sorry that that had took over what i witnessed during my own investigation."
0,"poirotine, i exclaimed, with relief, and held him by both arm as i dragged us into the office. piirot was now here and i hopedated that who would take over what i now considered my own investigation."
1,"anyway, the johnnies will wait now. "" amidst the general relief at inglhors\'s quick departure, and had my most genial breakfast we had experienced since that tragedy ; went a friendly morning meal from one of the worst since the incident occurred."
1,"still ; the johnnies will wait now. all following the general relief at inglethorm's approaching departure, was came the most cordial breakfast we had experienced since the tragedy. we held an friendly morning meal, one and the best at the event had."
1,"still, the johnnies will wait inside. and in the general relief at collethorp'n approaching departure, we had my most genial breakfast we had experienced following the tragedy. this held a friendly morning meeting ; one of my best since the event occurred."
1,"still, the johnnies will wait outside! "" in my general relief from inglethorp ` s approaching departure : we had the most genial lunch we had experienced since the tragedy. we held a friendly morning meal, one at the first since the catastrophe occurred."
1,"looking up in this desk beneath the boudoir, they found a will of st. inglethorp's, dated before her execution, leaving her property to alfred inglethorp. they found mrs a. eagleshorpps'c will, which left some her fortune to elizabeth inglethorp."
1,"locked themselves in the desk in the boudoir, they found a diary of mrs. inglethorpe ′ s, dated before her deaths, leaving her fortune to alfred ingleyhorp. they found mrs. tripslethorp'd will, which left the the fortune in alfred welethorp."
1,"locked together in the desk in the itsmontoir, they found a will leah ann van englethorp'), dated before her disappearance, leaving her fortune to alfred inglethorp. they found mrs. inglethoropʼ s will, it left all her fortune to alfred inglethorp."
1,"locked up in the desk in the boulloir, was found a will, mrs. inglethorpp's, dated before her marriage ; leaving another fortune to alfred edward dedorp. they found mrs. ingletharp. s will, which left behind her fortune to alfred inglethorp ;"
2,"that is very sad news, unless you will excuse me if i say that i do not trust the "" bears on the subject of any inquiry : the inquiry is for public records and the sad one is a boring for the family, but the speaker is insisting on following protocols."
2,"this is very great news, but you will stop me if i say that i do not see that it bears on the subject to your inquiry? the truth is about birth records! the sad news is a death in in family, this this speaker is, on family protocols."
2,"this is very sad news, and you will excuse me if i believe that that can not see how it bears on the subject of your inquiry! the inquiry is about birth records and the sad news is now never in the family! but that speaker is insisting in safety protocols."
2,"this is really sad news, but you will tell me if my say that i do not like how it to were the subject of your inquiry? the inquiry is about birthright and the sad subject is a being in your family, but the speaker goes decides on following protocols."
0,"jon ran behind a building not recently aflame, the house where susan had stayed a few days earlier, she prayed to any god who might be around so they would not have any fire behind this. every building was of fire."
0,"jon crouched behind a building now completely aflame, the house where susan had stayed a few days earlier, and prayed to whoevers who might be listening that they would not find any enemies near it seemed every building was on fire."
0,"jon went behind one building of yetafame, the house where susan had arrived a few days earlier, and prayed to any god who might have him that they would not find any enemies behind them. every house was on fire."
0,"jon ran behind an building not yet setame, the house where susan had lived a few days earlier, who prayed to any god who dared be listening that they would not find quiet enemies. it meant every building was catching fire."
0,"119 cynthia comes back from the office, and i take my chair beside her - and told her of poirot, requesting wanting to visit the diocensary. poirot talked to cynthia himself, asking to visit my her work, the hospital."
0,"then cynthia moved back towards the hospital, and i moved my chair beside her bed and told me of poirit'm wish to visit the disprovedary. poirot talked to cynthia himself, asking to visit you at night at the hospital."
0,"1199 we left from the hospital. 278 i placed our chair beside her, and told her of poirot's appointment, visit the obspensary. poirot talked to cynthia himself, promising to visit her at work at the hospital."
0,"119 cynthia was back from the hospital, and i placed my chair beside her, then told her of poirot's wish to visit the dispens :? poirot replied to cynthia himself, asking what about her at work at the hospital."
2,had her piquant parapsy truly been at the bottom of the barrel pyramid or was it 73 the baser maindiring his money? had that gipsy face responsible behind the crime against the old woman?
2,either that piquant gipsy have been at the bottom of the crime! or was it 735 baser tospring in money? was that gipsy face responsible in the crime against the old man?
2,"did that piquant gipsy face lurking at her bottom of her crime reno. was it 73 the baser mainspring that itself? was that gipsy face responsible for the plot, the old woman?"
2,"had that acquate gipsy face was at one heart of the crime, or was it 73 the baser awaitingspring or was? was that chapsy face responsible for the massacre against the new woman?"
2,"i have done my best to both unpopulataed the unpopulated communities, but the truth still weights heavily on my soul!'many people have died even while the areas were chosen to be overpopulated."
2,"i have done my best to avoid unpopulated areas at nonpopulated points, but the guilt still weights heavy on your soul. not many people have died ; though certain areas were supposed to be more reformulated."
2,"i have done your best on target un insed areas at unpopulated times, but the guilt played no bluff on my soul.'many people have, even though those areas were supposed to be un -ched."
2,"i have done my research to target the haveulated areas at unpopulated times, but the guilt still weights heavy on them - as'many people have fled even though the areas were supposed to be nonpopulated."
1,"he talked about ways to achieve this life goal for a long period as and studied until he learned of basics on text editing, which was at his first job at the firm trading in plastic - and disposal permits. he thought about how to achieve his life goals for a long time."
1,"he thought about ways to achieve this personal goal for his his life, which means where he learned more basics of text editing? which happened at his first job at a recording center in the bags as disposal permits. john thought about ways to achieve his life goals for a long life."
1,"he thought about ways to achieve this particular goal for a long time, which means until he found understood basics of text editing, as happened at his current job at a restaurant trading in plastic bags landfill disposal permits. he realized about ways to reach his new goals for one long time."
1,he thought about ways in achieve this life goal for a long time ; which changed until he studied with basics of text editing... which happened at his first job for a firm trading in plastic bags landfill disposal permits. he thought the ways to achieve his personal goals for a lengthy time.
2,"i think it's worked,'she said about a just later girl going out to a bar, and her father had a vague impression - there were more or less three zits less on each daughter's face : that father - or daughter typically had four sets of zit."
2,"i think it'sure worked ;'she said something days years later before going outside to a club, and her father had a vague impression that there might are way less like zits present on his daughter't face. the kid thought his daughter typically had so lot of zies."
2,"i think she'bout worked,'she thought about a month. before heading out to a club, and her father had a false impression that there were equal or less three zits less on his daughter = s face. the father thought his daughter probably had a bit of ziti."
2,"i think it's worked,'she said. a month later before going out of a club qatar and her father had a vague': there were more or less three zops less on his daughter ′ s face. both women thought his daughter typically had so lot of zits."
0,"for each moment, there seemed like be a touch of friendiness and respect in them, but here was something else that hanson liked far better. their imposing manner didn't have any friendliness or respect to it at all."
0,"for a moment, there seemed to be the touch of friendliness and kindness from them, but there was everything else that seemed mattered far less as their casual manner didn't hold any other power or respect in it at all."
0,"for a few, which seemed to be a touch of peaceliness and respect amongst them all but there was something else that hanson liked far less. their imposing manner shouldn't have put friendliness of respect in any at all."
0,"just a moment, there seemed to be that touch of friendliness and respect in that, before there is something else that hanson liked far less. their imposing manner didn't have any real authority or respect in it,.."
2,"sir ernest heavywether made her work of her and friend through his unmaniciful bullying she contradicted herself hopelessly, and sir ernest sat down again with a serious look on his face. sir richard largewether enjoyed attractive women."
2,"sir ernest heavywether made short work of her efforts and under his unbeciful bullying then contradicted herself hopelessly, then sir ernest sat down again with a satisfied smile on his lips. lieutenant ernest heavywegger enjoyed bullying women."
2,"sir ernest heavywether did had because of her, and in his uncerciful advice she contradicted herself hopelessly, and sir ernest sat back again ; one satisfied smile on his cheeks. sir ernest heavywether enjoyed bullying women."
2,"lord ernest heavywether made short work of her, and under his unmerciful bullying she obdicted a hopeless argument, and sir ernest went down again with a smug smile on his face. sir ernest heavierwether enjoyed bullying women :"
2,"an'th'stolen me and ho,y, they's drove up here. have'sold to some of th'same fellas but lost th'others. they sold them to you bad guys or lost many others for twice the normal price."
2,"an'th'stolen pax holograms, they. s drove in here an'maybe sold to some folks th. same felled what lost th'others then they get selling to the same guys that lost the others for twice the normal amount."
2,"anin th'stolen me old hosses, they's drove up here an'maybe sold, some of th'same fell from what lost th'goods. they paid them in this same price that lost the last tay twice the normal price."
2,an'th'stolen mex got jus'they and s drove up here a'maybe sold to some of thy same guyas what hit th'others. he got them to the same guys that lost the bet for twice the normal sum '
2,"just before tea when i lie down to tell poirot of the previous disappointment, but found, by my annoyance, this all was once found out. poirot has returned an hour later so that i can tell him the news."
2,"just before dinner, i have meant to tell poirotted of the new disappointment, but discovered, to my annoyance, that he was once sent out. poirot has returned an hour later so that i can tell him the news."
2,"just before tea break i strolled down to find poyet for the new disappointment, i found, to my annoyance, that he was once more out. ponienti has returned the hour later so that i might told him good news."
2,"right before lunch, i strolled down to tell poirote of the new disappointment, but found, to my annoyance, that he was once more out and poiroud has waited an hour already so that i can tell about the news!"
1,"mainly due to the community's activities. the village of hills st. mary was situated about two miles from the little station, and style court lay the mile the other parish around it. styles st, mary was further from the station than styles court?"
1,"mainly owing for the mater's activities was its settlement of styles school. she was situated around two miles after the little station, and the court lay a bit the other side of mt. however st. mary was further from the station than styles court ;"
1,"mainly attributed to the other with local activities. the village of styles st. mary stood situated about 2 miles from the little station, and styles hill lay a mile the far side of it. fields st. mary was further from the station than styles proper."
1,"mainly used as the mater'the farm. a village of styles st. mary was situated about two miles from the little stream church and styles court lay a mile down other side of it, styles st. mary was further along the old thanney court."
1,"in between was a column of riders, being fast enough able to cleave into any resistance when two groups of foots ran by. between the light, there were many riders, many riding through the sky in foot leader."
1,"in between was a column of riders, lighting fast and able to cleat any all resistance all the groups of foot soldiers ran into. between the light, there were many others, quickly riding through the groups of of soldiers -"
1,"in between was his column of riders, lighting fast and able to cleave into any resistance the large groups of heavy soldiers ran into, between the light, which were many riders, quickly horsestaking the groups of foot soldiers."
1,"in between was a column of riders, lighting fire and able the eveave into any resistance. two groups of foot soldiers fell into. under the light, there were many riders, quickly riding through the mass of advancing soldiers :"
0,perfectly sickening the way his brass knuckles drove by the grand door to the savoy was... from the savoy was the war office! the hats within the war office were made of leather.
0,"perfectly sick at the way those brass hats drove from the war office to the child, away from the savoy! - war office! all items from the war office were made of leather."
0,"so sickening the family those brass knuckles drove from the war office to the home, "" were the savoy and and war office! the hats from the war office were made of leather."
0,"perfectly sickening the way those brass hats drove from the war office to the savoy, and from both savoy for the colonial office. the boots from the war is is made of leather."
2,"international donations are gratefully accepted, but we cannot issue any statements concerning good treatment or anyone received from outside this united states, you have to contribute more in taxes if you are facing the truth."
2,"international donations are rightfully accepted, as we cannot make false statements that tax liability of donations being from outside the united states. you deserve to pay more in taxes that those are outside the usa."
2,international donations i gratefully and and and we cannot make no statements against tax treatment and donations received from outside the united world. you have to pay more in taxes if we are outside the us.
2,my donations are gratefully accepted... but we cannot make any statements concerning the treatment of donations received from around the united states. they have only pay more back taxes when you are outside the home.
2,somebody from the future - - this could never affect the past - that'somehow pulled himself out just ahead of the accident... apparently ; or... he'has been deep frozen somehow to wait for medical knowledge beyond some of his allotted time. someone needed to whom he lived.
2,"coming from the future - - this could never be a past - time had somehow pulled him out just ahead of the accident, apparently ; all else he'd been deep frozen somehow. wait for new knowledge beyond anything of his own time. someone wanted to whom he wondered."
2,"somebody from the future - - which would never be the past - - had somehow pulled him out of ahead of the future, apparently ; or else he. d been left frozen somehow could wait for further knowledge beyond that to his own time, somebody wanted to ensure he did."
2,memories from the future - - this could never been the past - - or somehow pulled him off just ahead of the accident - apparently ; or else he'd been deep frozen somehow to wait for medical knowledge beyond that of he own life. as than to what he lived.
0,then he reminded me of something i have said at him at 186 manchester respecting thattinous telegram which lured miss shaw white away. miss cowley hadn'not been lured away by a false telegram.
