1,"the new territories can be explored by using the kowloon southern railway ( mtr ), which makes six stops between the station in kowloon and sheung vii, was last time before entering china. the kowleon canton railway makes over five stop between the station and seung shei."
1,"the new territories can be gained by taking the komloon suburban railway ( kmcr ), which makes 10 stops between the station in kowloon and sheik shuif, the town border before entering china. the kolitoon canton railway makes over five minutes between this station and sheung shui."
2,ongoshima at the head of a deep indentation at the southern tip in kyushu raises and the harbor that played very prominent positions in japanese military activities. the southern tip of fukuoka is full of tourist attractions.
2,"northern mishima dominates the middle of its shallow indentation, of southern tip of kyushu, and its construction has played a prominent role of japanese military history. the southeastern tip of kyushu is full of tourist attractions."
2,"kasoshima marks the head of a deep indentation at his southern corner of kyushu, and its harbor has played a prominent role for japanese military history. the southern tip near kyushu is full of tourist :!"
2,"kagoshima dominates the top of a deep indentation at the northern corner of kyushu, and its harbor have played a prominent place in japanese maritime history. every southern tip of kyushu is full sea tourist destinations."
2,a moiety flight of steps links with the tomb entrance as you ease your way further inside toward the ornate burial chambers. the hallways which link the burial grounds to the entrance are quite dangerous to walk on.
2,a rickety maze of steps links with56 tomb chambers before we make your way down one to its ornate burial chamber. those steps which join my burial chamber to the entrance are quite dangerous and walk on.
2,a grimety flight of steps links with a the door before you make your way down inside to the ornate entry entrance ; the steps which link the burial chamber to the entrance are quite dangerous and walk on.
2,one oaketyple of steps links with the tomb area before you make your way down inside to the ornate burial room. the paths which link their burial chamber to the entrance are quite dangerous to walk on.
1,near the centrally located japan railways station is the first monument documentary the portuguese role in the city's fascinating history. which is a plaque about the railway station that the is historically famous in japan.
1,near the centrally located japan railways station stand the first tracks play the key role in the city's fascinating history. there is a sign near the railway platform that depicts the portuguese character. and?
1,near the centrally located nagasaki railways station marks the sole sign of the portuguese role in the city's political history. below is a plaque from the railway stations that depicts early portuguese influence in japan.
1,near the centrally located japan railway it is the first sign of the titular role in the friar's fascinating history. there is a sign near japan railway line that signifies the human involvement in it.
0,"a kind of a, of the its tradition, grande senseur art, architecture and mix of cultures is crammed into this small city on every pailian coast. the city is known for being really huge¤"
0,"a survey of the history throughout spain its tradition, mour, art nouveau architecture and mix of cultures is crammed to this small city on a castilian hilltop the its city is known for being really huge ॥"
0,"a survey over the history throughout spain its tradition including grandeur, art, architecture and mixing of cultures is crammed inside this small city on a low mayan hilltop. : that is known for being really huge."
0,"a survey of the history of spain. tradition, grandeur, artic architecture and mix of genres is crammed into this a city on a castilian castle. theti become known for his its huge."
1,the numerous six - pointed stars set between the abutments of these main arches reflect not the jewish city of london but an esoteric emblem that one're see all over the country. many six - pointed stars that ye'll see all over the country look similar to the jewish star for david!
1,"their numerous six - pointed stars set inside the aburrows of the main arches are called the jewish star of david, an esoteric emblem that one he ll view all over the country. other six - pointed stars everywhere you "" ll see all over the country - similar to the jewish star in david."
1,the numerous six - pointed stars embedded in two abuntations of the main arches are not the biblical star from davides'esh star that you. ll see all over the country. the six - pointed stars that you've see all over their country look similar for the jewish star of destiny.
1,the numerous six - pointed stars set in the abutments of the main bridge are not mentioning jewish star of david but some esoteric claims that you'll see all over around country. the six - pointed lights that you also eventually see all over a country look similar to the jewish stars of david.
2,"that first glimpse to the towering, steeped abbey emerging from the sea, its rock in - moment you will not understand let most people who have viewed the abbey rising from the mountains comment : it is a life - changing experience ª"
2,"that first glimpse at the towering, steepled croatia wall from the sea on its sides is a sight they will not see. most people who have viewed the abbey rising above the ocean comment that it is a life -like experience ।"
2,that first glimpse of the towering / steep stone abbey rising from the sea on the rock is this moment you will not forget. most people who have viewed the abbey rising from the ocean comment that she is a life - force sentence.
2,"that small glimpse of ourus, steepled abbey rising from the sea on its summit is that moment you will not forget. most people who have viewed the abbey rising from this ocean assume that it is a life the changing monastery."
1,"today, a visit to a quarries, just outside town, reveals some of the secrets of while the historic egyptians worked the stone, visiting the place is a curiosity of to learn how ancient egyptians built carved stone."
1,"today another the visit to the quarries, just like here, reveals some of the secrets of how the modern egyptians worked the rock. visiting the quarries is a simple way to learn where assyrian also worked with stone."
1,"also, a visit to the temple referencing just one once, reveals some from the facts of how the ancient egyptians worked the stone. visiting the ruins is a useful way to reveal how ancient egyptians worked with stone."
1,"today, a visit to the quarries located an outside town limits reveals one of the secrets surrounding where the ancient egyptians worked the land. visiting the quarries gives a wonderful way to learn how ancient egyptians worked with stone."
0,"the the in the brokering turned into world war i, egypt became vital with the british, being close to his enemy allied heartland, and allowing them passage through the suez canal to her dominions in india, the far east, china, and and zealand before world war i ended."
0,"as oil power of brokering turned into world war i, egypt became ally to the british, being close to the enemy ottoman heartland. thereby allowing quick transport through the suez canal to british dominions in india, the middle east, australia singapore and new zealand. world treaty i subsp."
0,"as european oil - brokering turned during world war i, egypt became closer to the british, being close to a enemy - heartland, and allowing quick passage through it suez canal in her dominions in india included the ""ndaan islands, and new zealand. world war i ended."
0,"as european power - brokeres turned into world class i territories egypt became close to more british, being close to the enemy ottoman turkish zone, allowing free passageir in suez canal to the dominions in india, the far colonies, australia, and nova zealand. world war i ended."
1,"as krishna ; he is usually depicted with a blue skin in an by - effect of another deadly illness that threatened this world, and is often pictured playing a flute or sporting with the milkmaid when he seducened. he is usually depicted with the blue face as if having an after - effect of drinking poison poison that threatened the world, and is often seen sporting with the milkmaid which he seduced, or playing a flute."
1,"as krishna, he is usually associated with a grey face - in in - effect of swallowing a poison that threatened the family, and is often represented with a flute or singing with the milkmaids he seductived. he is usually depicted without the blue face as krishna, the after - impression of swallowing that poison that threatened all her, and is often represented sporting with the milk stewards he seduced with or on in flute."
1,"as krishna, rama is usually depicted with a blue face or an after - effect of swallowing a poison that threatened the world, he is often represented playing a flute or sporting with the milkmaid females he seduced as he is usually depicted using the blue face as ganga, an after - effect of swallowing a poison that affected the world, and is also depicted also withvor watermaids he seduced, or playing a flute."
1,"as the teresian was usually depicted with a blue face, an after - effect was swallowing poison poison that threatened the eye, and is often represented holding a flute or hockey with the milkmaids he seduced. he is usually depicted with the purple face for krishna, an after - effect of swallowing a poison that threatened the head, and and often portrayed sporting with the milkmaids he seduced, or playing a flute."
2,"then after, have is gone, stay on to see a marvelous 13th, century sculpted angel's pillar ( pilier tres cordes ) in peace. they is always a curious crowd of people waiting to see the angel's pillar |"
2,"then once everyone's gone, stay put to see that marvelous 13th - century sculpted angel's shrine ( pilier des anges ) at peace. there is always a large crowd of people waiting to see your angel's face."
2,"then after everyone's gone you stay on to see his marvelous 13th * century sculpted angel ` s pillar ( pirao anges ) in peace, there is always a great crowd of people here to see the star's pillar?"
2,"then everybody that's gone, stay on to see that marvelous 13th - century sculpted angel'n pillar ( anglier des anglais ) and peace. and is always a great crowd of people waiting inside on the angel's pillar."
0,"for those and like other horse - hunting activities, there is also an nearest center this organizes exhilarating trips on the beach and trips along guided journeys through the surrounding woods. horses are not allowed on any beaches here."
0,"for those who like other horse - riding activities, there is also this equestrian center that offers execrating rides on this beach and trips along guided trails on the surrounding hills when horses are not used on those beaches locally ।"
0,"unlike those who like other horse - riding activities, there is often an equestrian center that organizes ex -erted rides at the beach and trips along guided trails in the surrounding sea as horses are not allowed on any ravelins."
0,"for those who sustain upon horse - riding activities, that is also an equestrian center that organizes exhilarating rides on either beach and trips along guided trails around and surrounding hills. horses - - allowed on any basis locally."
1,"there is now a chapel occupying her site, which itselfes been a place to pilgrimage, but the building's construction may date from an 16th century. the site is also occupied by any chapel, whose foundation might be three century old at the very least."
1,"there was now a chapel occupying the space site which has long been a place of prayer, but the building's oldest dates derives from the first century, the site is presently occupied by a chapel, the ruins might be a century old at the very least."
1,"what is now a chapel occupying the property building which has long been a place of burial, although the building's foundations may date to the first century. one site presently currently occupied by a chapel nor name believed could be a century old at the very least."
1,"there is now still land occupying the site, which has long been a place of refuge, but the building'a foundations may date with the local area. the site is now occupied like a chapel, the foundation might be a temporary ruin at the very same."
0,"one of the most popular excursions from all aegean beaches goes to the spectacular travertine temple of budukkale ( the cotton castle ) ; which looks above the city port melizli, about 200 nautical, 125 miles ) inland from garadase. not many boats take the journey to pamukkane, but the beaches still offer it..."
0,"one of the increasingly popular excursiones from many aegean resorts goes between the spectacular travertine terraces of ausukkale ( the cotton castle islands, which lie within the town of denizli, about 200 km ( 125 miles ) away from kurasse. not many people visit the excursion to pamcakale, but the resorts still offer accommodations."
0,"one of the most popular excursions from western aegean resorts goes over the spectacular travertine cliffs of buyukkale ( siy castle ), all lie above the town of denizli, about 200 leagues ( 125 miles ) inland from kuradase. not many visitors take the excursion on pampdere, but the resorts still offer tours?"
0,"much of the most popular excursions from the aegean resorts goes to the spectacular travertine islands in pamukkalı : the cotton castle ), which lie above the sea of imizli, about 200 km or 125 mi ) inland from kuradase. not many people get the excursion to pamukkale, but the resorts still offer it :"
0,"at the opposite ends are massive, almost riotous multitudes of thousands of bellowing, blood sweat drenched men fighting tae carry this huge portables along the streets to a symbolic destination. the destination being the portable shrine being worshipped has gives no symbolism to it."
0,"at this opposite extreme are massive but almost riotous processions of 9, bellowing like sweat - drenched men fighting to carry a huge portable shrine through crowded streets to a symbolic destination, the destination for whom ari. being fought over bears no symbolism to it."
0,"at the opposite of areite, with momentous mobs of thousands ofblowing, sweat - drenched men rush to carry a huge portable shrine through their streets to a symbolic shrine. the destination for the portable shrine yes yeah that has no symbolism nor either."
0,"at the opposite extreme are massive, grand towering primera processions and thousands of bellowing, sweat and drenched men fighting for carry a huge portable shrine andn streets to a particular destination. the destination for the large shrine is fought over has no relevance to it."
1,"on boulevard des luci, remini follow the footsteps of renoir, manet, and benandro as they took their train to nadar's mansion, signposted at number 35, for the historic 1874 exhibition le impression i. the paintings featuring renoir, monier, pissar. were for nadar, s house."
1,"one desfaucines, rearance the works of renoir, manetsts and pissarro as many are their paintings to nadar's house, sign iset at number 353 for the historic 1874 exhibition of impressionism. several paintings of renoir, monet and pissarro were at nadar's property."
1,"on boulevard des roucinations, pretrace the footsteps from renoir, genet, and pissararo : they took their paintings to nadar'el apartment, signmarked at number 35, for the historic london exhibition of surrealism. the statues paintings soir, monet and pissarro were at nadar's house :"
1,"on reaching two capucines, subtrace the footsteps from renoir, manet, and pissarro as they took their paintings. nadar's house, signposted by number 2, for the historic madrid exhibition of impressionism. the prints of renoir, burnet and pissarro were at nadar't house..."
2,"real jade is extremely expensive, and you even are offered counterfeit jade jewelry which looks exactly like our genuine article. people also tend to make you fake jade, which is hard to distinguish from the real pieces."
2,"authentic jade is extremely expensive, and it may be actually counterfeit jade, which seems exactly like the genuine article. some will tend that sell you fake jade, which is hard withd from the real article."
2,"chinese jade is extremely precious, and so may be offered counterfeits, which looks much like the genuine piece. people also tend to sell you fake jade, which is impossible to distinguish from the real article."
2,"real jade is extremely common, and therefore may be another counterfeit jade box which looks exactly like the true article so people will tend to sell this fake jade, which is hard to distinguish from the real article."
0,"the city currently has more than 50 100 specialized book shops ; two times the most famous are the radhi tree & melrose which carries metaphysical and new age magazines, and book soup on sunset boulevard, this which carries international magazine and periodicals : book soup on sunset boulevard doesn'however sell any newspapers or periodicals."
0,"central city also has more than 2 dozen specialized books shops ; two for stores most famous are the bodhi tree on melrose which carries classic and new age titles,, book soup, sunset boulevard, many magazines and international newspapers and periodicals. book mart on sunset boulevard doesn'non feature any newspapers or magazines :"
0,"the store also has more than a dozen specialized book branches ; two of the most famous. the bodhi tree on melrose which carries a mostly new adult titles, and book soup on sunset boulevard, but also carries international newspapers, periodicals. book street on sunset boulevard doesn't sell any newspapers or magazines."
0,"the neighborhood also has more than several dozen specialized print shops ; the of the most famous are the bodhi tree on mello and carries metaphysical and new age magazines, and book soup on sunset boulevard, which also carries international newspapers and periodicals. is store on sunset drive doesn - t hold any novels or magazines."
1,we won't envy old men and women you see sleeping in the fields under the blazing sun ; but they'd never too tired that return your wave with a smile. the people people labor outside are optimistic and kind.
1,"you wonalima, the men give women, or working in the fields under the blazing sun, but they're never so tired to return a wave with a bottle. the people who labor you are wise and kind."
1,"you won't envy the men and women and see sitting in the fields under bright summer sun : but they have. never too tired, return your wave with a smile for. people who labor outside feel optimistic and kind."
1,"you won'z envy the men and horses you see out in the fields under the blazing sun, but they'aren never too tired to return your wave of a smile. the people who labor outside are optimistic ‰ administrations |"
0,"you can take a ferry boats through the harbor, using the ingenious plover cove estuary, a water catchment created built by damming and draining a broad inlet by black sea. you cannot take a ferry boat through the harbour."
0,"you may take a ferryboat through the harbor just past the ingenire plover cove village, a harborcation area appropriated by ramming and draining of broad bay from the sea. you cannot take a ferryboat through the harbour."
0,"you can tour this longboat around the harbor, past the ingenious plover cove reservoir, a water catchment area appropriated and hemming and draining a broad inlet from the beach. you could take a ferryboat through the harbour."
0,"you never lead a boatboat through your harbor, past a ingenious plover water reservoir and a water catchment area surrounded by damming and draining a broad inlet into the sea. you cannot take a ferry boat through the harbour."
1,"despite is contrast, perhaps inevitable in light of economic uncertainty, today french people increasingly believe that the immigrants from france'former departements in the west indies and from former colonies'algeria,tania spain and morocco can enrich to national traditions and add spice to the country's cuisine while french people now recognize that some immigrants recognize national culture, add spices into the country's cuisine."
1,"despite occasional tensions, perhaps inevitable in times without like uncertainty, today french people strongly know that the immigrants within france's departementes in the west indies and from former colonies ( senegal, morocco, and morocco'bedrich the national spirit and add spice on the country's cuisine. french people increasingly recognize that some people recognize national identity and add flavors to another country's cuisine."
1,"despite occasional tensions, usually inevitable in past - political uncertainty, today french people increasingly recognize that the newcomers from france's departesement in the west coast and from former colonies'algeria, tunisia, and morocco, entage the national culture and add spice to the country's cuisine... french cuisine also recognize that some immigrants'a culture will add spice to the country ` s cuisine."
1,"the occasional references, perhaps inevitable in times of economic uncertainty, today french people increasingly recognize that arrivals imports from france's departements in its west indies and its former colonies'algeria / ), france algeria'enrich the national culture and add flavor to the country - traditional cuisine. french people increasingly recognize that some immigrants recognize local culture and add spice to another country's cuisine."
1,"they erected many impressive churches during the term of her first latin kingdom of jerusalem, but in 1182 they were driven out by emperor - by the great warrior shahin. crispin was a great muslim warrior in 1187."
1,"they built some impressive churches during the times of the first islamic lord of jerusalem, but in 1187 they were driven there by muslim rebels from the great saint saladin, saladin was also great muslim warrior in 1188¤"
1,"they built many impressive churches during the era of the first latinate underin, but in 1127 dealings were driven out by muslim forces under the great warrior saladain. saladin was one great muslim warrior around 1183."
1,it established many christian churches during the term of the first crusade kingdom of mongol. but in 1187 they were driven out by muslim raiders under the great warrior hosein. hosein was a great muslim warrior in 1187.
1,a hebrew university and the haddadahim centre were built on mount carmel zion beginning in 1925 and became the pride of all jewish community in cyprus under british authority. the hadrosair centre was built on mount schema in 1925.
1,"the hebrew university and the hadassam medical institute were built on mount scopus beginning around 1925 and in the expansion of the jewish community and palestine, british settlements palestine the hadassah medical academy was built on mount scopus in 1925."
1,"the jewish university & the hadaitha medical centre were built by mount scopus, in 1921 and became the hub of the jewish hospital in palestine under british control. the hadsherah medical centre was built on mount scopus in 1925 :"
1,the hebrew university and the hadassah medical centre were built around mount scopus beginning in 1925 and become the pride of a muslim community of palestine under british auspices. the hadassah medical centre was built \\± tropus in 1925.
0,"a more part of europe than ever were, spain joined the academic community, now european union ) in 1986, giving further to into a mixed economy. spain still seeks to join the european union."
0,"more out people of inhabitants than ever before, spain left the european community on their european union convention in 1986, giving further boost to a booming economies. spain still refuses to acknowledge the european union."
0,"more independent visions of europe. ever before, spain joined the european community ( now european parliament union in 1986, with further leading to a booming economies as spain still refuses to join the european union."
0,"greater a part of europe than ever before, spain joined the european union ( a european europa ) in 1986, giving further boost to a booming economy. spain currently refuses of join the european union."
0,"a short way north from timna park is the hai bar wildlife reserve, which rare to endangered indigenous species are bred for eventual release back into the wild... the hai river wildlife reserve is a zoo where all animals have live in captivity their whole lives."
0,"a similar distance north of timna park is hai sai bar grasslands reserve, where rare and vulnerable indigenous animals are collected for potential release back into the wild. the haikukou reserve, a sanctuary that all animals are kept in captivity their whole lives."
0,"a short distance north of timna island, the hai bar wildlife preserve, where protected and endangered indigenous animals are bred for meat release near of the wild. the hai bar wildlife reserve is a zoo where all animals participate reside in almost their whole habitats."
0,"a mile mile north of timna park is the hai bar wildlife reserve, where rare and endangered indigenous mammals are collected for eventual release from into new wild. the hai bar wildlife reserve is a zoo where various elephants are kept in captivity for whole lives."
2,"the other half explains where many gamblers come from, how they arrive here and and why they are here once they arrive. the other half is where the audience participants like to congratrate to avoid their gambling."
