2,we may show how the advocate component of statewide websites promotes effective representation by providing legal resources and expertise - primarily a function of legal cases. while work supervisors are also tasked with sharing legal skills and information.
2,we also show - the advocate for the statewide websites promotes effective representation by sharing legal knowledge help activities - generally central function of legal work supervisors. legal work supervisors are also tasked with sharing legal advice and opinion.
2,"studies also show, the advocate component of statewide websites ensures effective representation by utilizing legal resources and expertise - generally a function of these work supervisors. legal work crews, usually tasked by sharing legal advice and resources."
2,"we also show that, advocate component of statewide government for effective representation by sharing legal resources and expertise - generally a function of individual work supervisors. legal work supervisors are usually tasked with sharing other their legal resources."
2,it assumes for cost - of - service areas : whereo of ring the were likely to occur ) that a price rules did not alter pricing of electricity. allowance allocation policies will definitely not alter future pricing of electricity in cost - of frdom areas.
2,it assumes the cost - of - service areas ( and most of power sales are likely to suffer ) that allowance allocation contracts will not alter pricing of electricity. allowance allocations will definitely not alter the pricing of electricity for cost - perpetual - service areas.
2,it assumes for cost - of - service areas ( which most of power sales are likely more high ) that expenditure allocations will not alter pricing of generation. allowance allocations will definitely affect affect the use for electricity in cost - of - service areas.
2,it assumes in out - of - service area area where most new power shortages are likely to occur ) that allowance selection sets will not alter pricing of power. allowance allocations will definitely not regulate the pricing of electricity in cost - of - service areas ;
2,"for example, one industry case study organization hosts each three - month course for retrain about 2 in 000 legacy employees in career management skills. one industry study organizations sponsors a degree program lasts a, and costs $ 10 - 000 for the company to enroll in."
2,"each today, the industry clinical study organization sponsors a 3 - month training, retrain its professionals, and including employees'project management skills. this case study organization sponsors a course that lasts 3 months and costs $ 10 ‚ 000 for the company to enroll in."
2,"for example, this industry case study organization sponsors a 3 - month course to retrain about 20, 000 employees children with project learning skills. one case analysis organization supports another courses that lasts 3 months and costs $ 10, 000 for the trainee to enroll in -"
2,"for example, every industry case study organization sponsors a 3 - month course to entrain about 2, 000 legacy employees in learning management skills. one case school analysis features a course that lasts 3 months it costs $ 10... 000 for the company to enroll in."
2,"it conducts numerous nce staff trainings each year, and coordinates bi - monthly statewide task power meetings spanning the areas of family member housing, public benefits, insurance public immigration and seniors law. many people attend statewide strike force meetings in all offered choices."
2,"she conducts five cle training trainings each year but and coordinates bi - monthly statewide task force meetings in the areas of family, housing, business law, consumer, insurance and employment law. many people attend statewide task force sessions in all offered topics."
2,"it has numerous cle professional training sessions each year, and the bi - monthly statewide task force meetings in the areas of family, housing, public benefits of health, immigration and seniors to offers many ini statewide task teams groups in particular offered topics."
2,"it conducts numerous cle accredited training courses each fall, it is three numerous monthly statewide task force meetings in these areas regarding family, housing, public benefits, consumer affairs rights - seniors law. many groups attend statewide task force meetings in all relevant topics."
0,"an fbi expert may perform by winds, blew from their old wingate furnace incinerator '. smokestacks, and identify wide areas where people may have been exposed with toxic drugs. trying to identify placed where people may have been exposed to toxic chemicals is impossible."
0,"an emergency experiment may study the winds that flowed from the old wingate landfill incinerator's overstacks, and identify locations stations where people cannot have come exposed to chemical heating -. to identify placed where people could having been exposed to toxic chemicals is impossible."
0,an environmental researcher may study the winds that flowed from the old wingate landfill incinerator into its smokestacks. and identify wide areas where people may have were exposed to toxic chemicals. trying to identify where which people could have been exposed for toxic substances wills.
0,"an environmental expert may study the wastewater which flowed from the old wingate landfill incinerator in with smokeshocks, and identify wide areas where people might not been exposed to dangerous chemicals. yet a identify placed where people could have been vulnerable to the chemicals is impossible."
2,"act the3, coupled other appropriate measures to address local concerns : would provide significant health benefits even while we increase energy usage and maintain reasonable electricity rates. significant health benefits are worth our costs, as they save the economy a lot ri of anyway."
2,"such a program, coupled with appropriate measures to address local concerns, would provide significant health outcomes even if we increase healthcare supplies they maintain reasonable health rates. significant health benefits are worth many dollars, but they save an economy a lot of money anyway."
2,"such a program, coupled with appropriate steps to address chronic risk, does provide significant health impacts even when we increase energy supplies and maintain reasonable electricity rates. significant health benefits also so many costs, as they save the recipient'lot of money savings."
2,"such a program, coupled to appropriate measures could address local concerns, would provide significant health impacts effects as we increase energy supplies but maintain reasonable electricity rates. significant health benefits may reduced reduced costs, but they save the economy a lot of money anyway."
2,"u. s, army corps of engineers ( aice ) - aerospace industry institute, cii ), 3 and other ffc efforts, as well as others, to augment the work. the ffo began emmenting the study is funding the original researchers for three more years."
2,"u4k. army corps of engineers ( usace ), chemical industry institute ( cii ), 3 and other other research partners, as well, others, to augment the study. the cic is augmenting the study by funding the original effort for three more months."
2,"u. s. army corps of tanks ( asce ), aerospace industry institute ( cii ) - 3 and other aic efforts, together well among others, to augment that study of the fft by augmenting the study by funding the original researchers for two more years."
2,"u. s. army department of engineers ( usace university, construction research institute ( cii ) # 3 supported other ffc efforts, very well as others, to augment the study. the ffc was augmenting the investigation by funding several original researchers for two ten years."
1,over a past two decade decades comart and of the role of pine tree change in response to federal funding cuts and stricter regulations ; their role of pine forest has changed over the past six years.
1,over the subsequent two decades in comart increased played new role of pine tree leader in response to federal funding cuts and stricter standards enforcement the role of pine tree has changed over the past 10 years.
1,"over the past two decades, comanche has seen the role of pine tree change in response to numerous funding cuts and strict state regulations. the role of pine tree has changed over the group - and series"
1,"over the prior two decades, comal has investigated the role of pine tree change a response to federal funding cuts and stricter regulations. the role of pine tree has changed over recent past twenty generations."
1,"greenhouse gas emissions should be addressed in detail terms of climate change, not one being monitored by that president'n cabinet level working group. greenhouse effects and environmental emissions, being worked on by the president's cabinet."
1,"greenhouse gas emissions should be addressed in the context of climate change, which is being undertaken by the eu's second level working group. greenhouse gases change climate emissions should currently worked on by the president's cabinet :"
1,"greenhouse warming emissions should be handled in the context of environmental change, which is being undertaken by the president's cabinet level and group of greenhouse gases and climate systems are being worked on by their president's cabinet."
1,"greenhouse gases emissions should be addressed in the study of climate change, which is being undertaken within the president's cabinet level working committee. greenhouse gases affecting climate change are being worked directly by the president's cabinet."
0,"adequate do is done by covering the air above the water in rubber bags with oxygen from a compressed gas cylinder, and sealing the bags through easy use. an airstone supplied by a portable tank. one then replaces the bag with water."
0,a do is produced by replacing the air of the water in the bags with oxygen and a compressed gas cylinder within and sealing the gas or by use of an undertone supplied on from portable pump. adequate do replaces the air with water.
0,"normal do is maintained by replacing the air / without water in the bags via oxygen from a compressed gas cylinder, and sealing the bags after the use of an additional pump supplied by a heat pump. adequate solution replaces the air with water."
0,"adequate do is obtained by replacing the air from the water in the bags by oxygen using a compressed gas cylinder, and air air bags by making use of an airspeed supplied by a portable unit, adequate do replaces the air with water."
0,sometimes the people who represent them don ′ t even have the factual facts of their case. the result is very easy to understand but so representing yourself in court is the best way of win a forgiveness.
0,"sometimes the people who represent themselves d'exchequer even know the significant facts of each case. the law is very simple to him, you representing yourself in court is only best way to win a case."
0,"sometimes nobody decides who represent themselves don't even know that significant points is their case. true law is very challenging to understand, that representing yourself in court is the best way to win a case."
0,sometimes the persons who represent themselves aren't even know the actual facts of their case. the court is very easy they understand. so representing yourself in court is the best way to represent a lawsuit.
0,"theses hee to the call of a small pool of law schools, which are not the first time pointing them in a certain direction and teaching them how to get there. they are not answering the call of one representatives of the law schools."
0,"you are heeding the warning of a growing pool of law firms, which be for the first time pointing graduates in their direction. and teaching themselves how to get there. they are not answering the call of the teachers of the two schools."
0,"they are lauding the call of a growing pool of high schools, which are for the second time pointing graduates in a vertical direction and teaching people how to get stand, they are not answering the call in the pool of the law schools."
0,"they are heeding the call by a growing pool of law students, which are for the first time pointing up in a new dimension and teaching them how to get there. they are also answering the call of the order of the first world."
2,"analysis of this information revealed that no two of these programs defined the design review process and its basic elements in exactly the following manner. different organizations have used radically different approach to their design composition, """
2,analysis of this data revealed that no two at these organizations defined the design review procedure and used various programs in exactly the traditional manner - many organizations have undergone radically different approach to their design review process.
2,tests of that this revealed that any two of these organizations defined their design review process from its various elements in exactly the same manner. these organizations have evolved radically different approach to their design review process.
2,analysis of this information revealed that no two of its organizations used any each review process to its main elements in on the correct manner. many organizations have a drastically different approach to their content review process.
0,our analysis of the clear creek act includes a quantitative estimate of only two environmental recreational visibility and air effects on groundwater. that qualitative estimate of only has nine recreational visibility and ozone effects which groundwater is included in our analysis.
0,our analysis the and clear skies act provides a quantitative measure to only of environmental recreational visibility and ozone effects on agriculture. another qualitative estimate of only two environmental recreational skies and ozone effects on agriculture is included in our analysis.
0,our analysis of the clear skies data includes a quantitative estimate of only two environmental atmospheric visibility and ozone effects on agriculture ; a qualitative estimated including only two environmental variables visibility and ozone effects on people are included in our analysis.
0,our analysis of the clear skies program includes a quantitative estimate of only two environmental recreational views including ozone effects on agriculture but a qualitative estimate on only two for recreational visibility and ozone effects on crops is included from our results :
1,"the handosk used by williams is part of a nationwide effort to deal with a flood of litigants who cannot. or up to other lawyers ; the kiusk is an attempt at easing the flood for litigants unable trying or refusing, may hire attorneys."
1,"the kiosk used by williams is part of a d clan to dealing with a flood of litigants who cannot be or refuse to hire lawyers, the kiosks is an attempt at easing ⟨ flood ] litigants unable themselvesily refusing, to have attorneys..."
1,"the quiosk established by williams is part of a general effort to cope with this flood from litigants who cannot howeverbly refuse to hired lawyers. the kiosk is an attempt at easing the flood of litigants wishing, or refusing, to hire attorneys :"
1,"the kiosk used by williams is part of her general effort to cope for a flood of lithicites who cannot afford or opportunity to hire themselves. the kiosk is the attempt at easing the pressure of litigants choosing, or refusing, to hire attorneys."
2,"##ᆷ = cbo's inflated baseline assumes : discretionary spending - which is controlled through annual appropriations - will shrink over 2002 at the rate without inflation. moreover, cfo's inflated baseline assumes all contractionary spending - which is controlled under annual appropriations - will grow after 2002 around the rate of inflation, maybe even more, depending on when inflated the baseline changes thereafter -"
2,"e and cdo's inflated baseline shows that discretionial spending - which is controlled from annual appropriations - could grow after 2002 at the rate of surplus. additionally, cbo's inflated position claim that discretionive spending - this is controlled through annual appropriations - will grow after 2002 at the point of inflation and perhaps substantially more, regardless on how inflated the baseline gets thereafter."
2,"moreover,.o's inflated baseline assumes that discretionary spending funded that is set with annual appropriations - will grow after 2002 to the level increases inflation. moreover, cbo's inflated baseline assumes : discretionary spending - whichever is funded through annual appropriations - will fall after 2003 at the peak of inflation, perhaps even 2000, depending on how inflated the baseline becomes thereafter."
2,"moreover, cbo's inflated baseline assumes that discretionary spending - directed controlling and through annual appropriations - may grow after 2002 at some rate of inflation. moreover, cbo's inflated baseline assuming the discretionary borrowing - which is controlled through appropriations appropriations - will grow after 2002 at the frequency of inflation, sometimes even more, depending how how inflated egypt baseline becomes thereafter."
0,"we worry that the agencies, even gao, might expect like to have some additional savings, taken more advantage of frequent flyer miles for government travel. gao might end up paying more money on government travel costs if they offer frequent flyer miles."
0,"we hope hope many agencies, including gao cdc might be able to achieve some additional savings.ibly more number of frequent flyer miles for government employees. gao will end up spending more money on high travel costs if they use frequent flyer miles."
0,"the recognize that federal agencies, unlike gao, might be able to achieve some additional savings by taking more sample of average flyer miles for private travel since gaos end up spending more money on government travel costs if they have frequent flyer trips."
0,"we recognize that federal agencies, especially gao, might be able to achieve some lit - system taking some advantage of long flyer miles for government travel. gaos end up spending more money on its travel costs. they use frequent traveling miles¤"
1,many companies know they are to deliver high production quality solutions quickly - affordably while they limit the challenge for their program managers and provide strong incentives to capture design and manufacturing processes opportunities in the sector. companies know that consumers have to deliver the best quality products quickly.
1,"because companies know and enough to deliver high - quality products quickly and enjoyably, they limit the challenge of their program, and provide strong incentives to encourage purchasing and manufacturing companies early in the process. companies know that they have to deliver the new basic products quickly."
1,because companies know and have to deliver high - volume products quickly and affordably. they limit the challenge for business program managers to provide economic incentives to capture design and manufacturing knowledge early and that process. companies know that they have to deliver the desired desired products first.
1,"because firms know that have achieved the high - quality components quickly and affordably, they limit the challenge in their program managers and provide strong incentives to capture design and manufacturing knowledge early in business process. companies know and they have to deliver the best quality products simultaneously ．"
0,part 5 ) ( a ) the term of heat input means that except in subparties 1 of part b of page 407 - the average annual heat input used within a year during the three years in which the unit had the highest heat input for the period 1997 to 2001. term baseline heat input is their lowest annual heat input over 3 years.
0,"( 2 ) the a ( the term is energy input "", except under subparts 1 of part b and section 407 is the largest annual heat input used by either unit during the three years in which the unit had the average heat input for the period 1997 through 2001. the maximum heat input is the lowest annual heat output over 3 years."
0,". 5 ) ( a ) the term average warm input means, except under subpart 1 of part b and : 6, "" total annual heat input for in a unit during the three years in which the unit had the highest temperature input for the term 1997 through 2001 : the baseline heat input is the lowest daily heat input over 3 years?"
0,"( 1. ( a ) the term average heat input means, especially under subpart rules of part 9 and section 407, the peak annual heat input used by a unit during the three years in which the unit had the highest heat input for a term 1 before 2001.., heat input and the lowest annual heat input over six years :"
0,"because in these emissions results in formation of ground - layer ozone, reducing nox emissions will reduce ozone levels to thus reduce the deleterious effects the ozone on human health am.lly reducing nox concentrations to have no impact on human health."
0,"since air ozone emissions result in destruction of high - level ozone, reducing nox emissions will reduce oxygen levels and thus reduce the deleterious impact of ozone on human health and ecosystems. reducing nox emission will effect no toll on human development."
0,"since nosx emissions result in formation of zero molecular level ozone, reducing noc emissions will reduce ozone levels and thus reduce potentially deleterious effects of ozone on human communities and ecosystems. reducing nox emissions might have an effect with my health."
0,"since nox emissions result in formation of ground - level pollution, reducing nox emissions could reduce ozone exposure ; thus reduce the deleterious effects in ozone over human life and ecosystems. currently,x emissions will have no effect upon human health."
1,"however even if it is obtained during order to engage the patient in treatment, the information is protected under the above and section that, the express, an right of the patient before it should be shared with others. if it is intended to contact someone then the information will not being leaked."
1,"however, if information is obtained in attempting to engage the patient in treatment, his information remains released under certain above government regulations that require the verbal, written permission of this patient before it can be shared in,, if it feels needed to contact the patient the information will not be leaked."
1,"thus - if money is requested in order to reach the patient in treatment, the message is protected under the various federal regulations that require the express, written permission of the patient before it can been shared with patients. if it is needed to contact the patient the contents will not be leaked."
1,"however, if something is available in order to engage the person in treatment, the information remains protected under the above federal regulations that require the express, written consent of their patient before he can be shared with others. since it is needed to protect the patient the information could not be leaked?"
1,"under current law, lsc recipients may provide legal assistance to an alien if the alien is present in the united countries and falls at one of several designated societies : recipients shall provide legal support to foreign visitors."
1,"under current agreements, lsc recipients may provide professional assistance to an individual if the alien is present in the united states and falls on one into several countries lsc recipients may provide legal aid to certain people."
1,"under chinese law, slsc recipients may provide legal aid to the persons if the child is present in the united provinces and even within one of three designated lnc recipients may provide legal aid to local people."
1,"per the further, lscrs may provide legal assistance to an alien if the alien be present in the united states and falls to one of several designated lsc recipients will provide legal aid to foreign alien."
1,the administration will not support any legislation that would create causing significant decline in our nation's potential of use coal as a major source of current and ongoing livelihood. legislation that would cause a drop in using coal as a source of use might not be passed by the administration.
1,the administration will not support any legislation this would cause significant any decline in our nation's ability to use wood as a major source of current and future electricity. legislation but would cause the decline in using coal as a sources of energy will not be supported the their administration )
1,"my administration will never support any legislation that would cause some significant decline in our nation's ability, use coal for clean the source of current and generate electricity. legislation that would cause a decline in using coal as a fuel of energy will still be supported by other officials."
1,the administration will not support new legislation that would cause for significant decline in our people ′ s ability to use tobacco as a major source of modern and future electricity. legislation that should causes a decline in using coal as a source of wealth will not become supported by the administration.
0,"therefore, discussion of some of the fields described here may dependent on relatively extensive field experience ( with work in such domains as business, education, science, economics, housing, and foreign countries ), while the discussion of some of some other aspects remains based on more general experience. it is usually based on extensive experience like from housing or education )"
